[
  {
    "coordSource": "fixed",
    "counts": {
      "byDecade": {
        "1790s": 1,
        "1820s": 9,
        "1830s": 18,
        "1840s": 25,
        "1850s": 35,
        "1860s": 37,
        "1870s": 47,
        "1880s": 52,
        "1890s": 148,
        "1900s": 141,
        "1910s": 109,
        "1920s": 103,
        "1930s": 94,
        "1940s": 34,
        "1950s": 24,
        "1960s": 11,
        "1980s": 5,
        "null": 1
      },
      "byKind": {
        "poem": 39,
        "song": 432,
        "unknown": 423
      },
      "total": 894
    },
    "id": "au",
    "lat": -27,
    "lng": 133,
    "name": "Australia",
    "newspapers": {
      "Adelaide Observer": 6,
      "Advocate": 2,
      "Age": 4,
      "Albury Banner and Wodonga Express": 2,
      "Alexandra Times": 2,
      "Alexandra and Yea Standard and Yarck, Gobur, Thornton and Acheron Express": 1,
      "Argus": 3,
      "Armidale Chronicle": 1,
      "Armidale Express and New England General Advertiser": 2,
      "Australasian": 4,
      "Australasian Chronicle": 4,
      "Australian": 1,
      "Australian Town and Country Journal": 5,
      "Australian Worker": 6,
      "Australian Workman": 1,
      "Avoca Mail": 1,
      "Bacchus Marsh Express": 1,
      "Ballarat Courier": 1,
      "Ballarat Star": 1,
      "Bathurst Daily Argus": 1,
      "Bathurst Free Press and Mining Journal": 1,
      "Bathurst Times": 1,
      "Beaudesert Times": 2,
      "Bell's Life": 2,
      "Bendigo Advertiser": 3,
      "Bent's News and Tasmanian Register": 1,
      "Blackwood Times": 1,
      "Blue Mountain Echo": 1,
      "Blue Mountain Star": 1,
      "Border Watch": 2,
      "Bowral Free Press": 1,
      "Bowral Free Press and Berrima District Intelligencer": 1,
      "Braidwood Dispatch and Mining Journal": 2,
      "Brisbane Courier": 1,
      "Bunbury Herald": 3,
      "Bunbury Herald and Blackwood Express": 1,
      "Bunyip": 5,
      "Burra Record": 1,
      "Burrowa News": 1,
      "Cairns Post": 4,
      "Camperdown Chronicle": 1,
      "Canowindra Star and Woodstock Recorder": 1,
      "Catholic Press": 3,
      "Central Queensland Herald": 1,
      "Chronicle": 2,
      "Clarence and Richmond Examiner": 2,
      "Clipper": 1,
      "Coffs Harbour Advocate": 2,
      "Colonial Times": 2,
      "Colonist": 1,
      "Colonist and Van Diemen's Land Commercial and Agricultural Advertiser": 1,
      "Cornwall Chronicle": 3,
      "Country Life Stock and Station Journal": 1,
      "Critic": 1,
      "Daily Herald": 1,
      "Daily Mercury": 1,
      "Daily News": 1,
      "Daily Standard": 2,
      "Daily Telegraph": 1,
      "Darling Downs Gazette and General Advertiser": 1,
      "Deniliquin Independent": 1,
      "Direct Action": 1,
      "Dungog Chronicle : Durham and Gloucester Advertiser": 1,
      "Euroa Advertiser": 1,
      "Evening Journal": 5,
      "Evening News": 6,
      "Federal Capital Pioneer": 1,
      "Forbes Advocate": 1,
      "Free Lance": 1,
      "Freeman's Journa": 1,
      "Freeman's Journal": 12,
      "Geelong Advertiser": 1,
      "Geelong Advertiser and Intelligencer": 2,
      "Gippsland Times": 1,
      "Gosford Times and Wyong District Advocate": 1,
      "Goulburn Evening Penny Post": 1,
      "Goulburn Herald": 2,
      "Goulburn Herald and County": 4,
      "Goulburn Valley Stock and Property Journal": 1,
      "Great Southern Advocate": 1,
      "Gundagai Independent": 1,
      "Gundagai Times": 2,
      "Gundagai Times and Tumut, Adelong and Murrumbidgee District Advertiser": 3,
      "Hamilton Spectator": 1,
      "Hamilton Spectator and Grange District Advertiser": 1,
      "Hawkesbury Courier and Agricultural and General Advertiser": 1,
      "Hay Standard and Advertiser": 1,
      "Herald": 3,
      "Hillston Spectator and Lachlan River Advertiser": 2,
      "Hobart Town Gazette and Van Diemen's Land Advertiser": 1,
      "Hobarton Guardian, or, True Friend": 2,
      "Horsham Times": 2,
      "Hummer": 3,
      "Huon and Derwent Times": 1,
      "Illawarra Mercury": 4,
      "Independent": 2,
      "International Socialist": 2,
      "Inverell Times": 4,
      "Jerilderie Herald and Urana Advertiser": 1,
      "Kadina and Wallaroo Times": 1,
      "Kalgoorlie Miner": 1,
      "Kiama Independent, and Shoalhaven Advertiser": 2,
      "Kilmore Free Press and Counties": 1,
      "Lachlander and Condobolin and Western Districts Recorder": 1,
      "Land": 2,
      "Launceston Advertiser": 1,
      "Launceston Examiner": 3,
      "Leader": 3,
      "Lithgow Mercury": 2,
      "Longreach Leader": 2,
      "Mackay Mercury": 1,
      "Mail": 1,
      "Maitland Mercury": 1,
      "Maitland Mercury and Hunter River General Advertiser": 1,
      "Manaro Mercury": 1,
      "Manaro Mercury, and Cooma and Bombala Advertiser": 1,
      "Manilla Express": 1,
      "Maryborough Chronicle": 1,
      "Maryborough Chronicle, Wide Bay and Burnett Advertiser": 4,
      "Melbourne Punch": 1,
      "Mercury and Weekly Courier": 1,
      "Miners' Advocate and Northumberland Recorder": 2,
      "Mirror": 1,
      "Molong Express and Western District Advertiser": 1,
      "Morning Chronicle": 1,
      "Mount Alexander Mail": 1,
      "Mudgee Guardian and North-Western Representative": 6,
      "Murrumbidgee Irrigator": 2,
      "Muswellbrook Chronicle": 1,
      "Myrtleford Mail and Whorouly Witness": 2,
      "Narracoorte Herald": 1,
      "National Advocate": 2,
      "Nepean Times": 2,
      "Newcastle Morning Herald and Miners' Advocate": 2,
      "Newcastle Sun": 1,
      "News": 1,
      "Newsletter": 1,
      "Newsletter: an Australian Paper": 1,
      "North Melbourne Advertiser": 1,
      "North Queensland Register": 1,
      "North West Post": 1,
      "Northern Argus": 2,
      "Northern Miner": 9,
      "Northern Standard": 1,
      "Northern Territory Times and Gazette": 1,
      "Northern Times": 1,
      "Nowra Leader": 1,
      "Observer": 1,
      "Ovens and Murray Advertiser": 4,
      "Petersburg Times": 1,
      "Port Adelaide News and Lefevre's Peninsula Advertiser": 1,
      "Port Augusta Dispatch": 1,
      "Port Fairy Times and Macarthur News": 1,
      "Portland Guardian": 1,
      "Portland Guardian and Normanby General Advertiser": 3,
      "Prahran Chronicle": 1,
      "Queanbeyan Age": 2,
      "Queanbeyan Leader": 1,
      "Queensland Country Life": 1,
      "Queensland Figaro": 1,
      "Queensland Figaro and Punch": 2,
      "Queensland Times": 1,
      "Queensland Times, Ipswich Herald & General Advertiser": 1,
      "Queenslander": 10,
      "Quiz and the Lantern": 1,
      "Reformer": 1,
      "Register": 1,
      "Riverine Grazier": 2,
      "Rockhampton Bulletin": 1,
      "Scone Advocate": 1,
      "Scrutineer and Berrima District Press": 1,
      "Smith's Weekly": 2,
      "Smiths Weekly": 1,
      "Snowy River Mail": 1,
      "South Australian": 1,
      "South Australian Chronicle and Weekly Mail": 1,
      "South Australian Register": 2,
      "South Australian Weekly Chronicle": 2,
      "Southern Cross": 4,
      "Southern Times": 1,
      "Sport": 1,
      "Standard": 1,
      "Sun": 1,
      "Sunday Times": 4,
      "Swan River Guardian": 1,
      "Sydney Chronicle": 1,
      "Sydney Gazette": 4,
      "Sydney Gazette and New South Wales Advertiser": 2,
      "Sydney Mail": 4,
      "Sydney Mail and New South Wales Advertiser": 5,
      "Sydney Morning Herald": 4,
      "Sydney Stock and Station Journal": 4,
      "Sydney Wool and Stock Journal": 1,
      "Tasmanian": 1,
      "Tasmanian and Port Dalrymple Advertiser": 1,
      "Telegraph": 2,
      "The Advocate": 7,
      "The Age": 3,
      "The Albury Banner and Wodonga Express": 3,
      "The Argus": 1,
      "The Australasian": 3,
      "The Australian": 7,
      "The Australian Star": 3,
      "The Australian Town and Country Journal": 1,
      "The Australian Women's Weekly": 1,
      "The Australian Worker": 2,
      "The Australian Workman": 1,
      "The Barrier Miner": 2,
      "The Bathurst Post": 1,
      "The Bendigo Advertiser": 2,
      "The Biz": 1,
      "The Border Morning Mail and Riverina Times": 1,
      "The Border Watch": 3,
      "The Bowral Free Press": 1,
      "The Braidwood Dispatch and Mining Journal": 2,
      "The Braidwood Review and District Advocate": 1,
      "The Britannia and Trades' Advocate": 1,
      "The Broadford Courier and Reedy Creek Times": 2,
      "The Bunyip": 1,
      "The Burrangong Argus": 1,
      "The Cairns Post": 1,
      "The Camperdown Chronicle": 1,
      "The Canberra Times": 4,
      "The Capricornian": 3,
      "The Catholic Press": 5,
      "The Central Queensland Herald": 3,
      "The Cessnock Eagle and South Maitland Recorder": 7,
      "The Chronicle": 2,
      "The Clarence and Richmond Examiner": 1,
      "The Clipper": 3,
      "The Cobar Herald": 1,
      "The Cobargo Chronicle": 1,
      "The Colonial Advocate": 1,
      "The Colonial Times": 1,
      "The Colonial Times and Tasmanian Advertiser": 1,
      "The Commercial Journal and Advertiser": 1,
      "The Cootamundra Herald": 1,
      "The Courier": 1,
      "The Courier-Mail": 1,
      "The Critic": 3,
      "The Daily Advertiser": 1,
      "The Daily Examiner": 1,
      "The Daily Herald": 2,
      "The Daily News": 3,
      "The Daily Northern Argus": 1,
      "The Daily Standard": 6,
      "The Daily Telegraph": 2,
      "The Darling Downs Gazette": 1,
      "The Dubbo Dispatch and Wellington Independent": 1,
      "The Dubbo Liberal and Macquarie Advocate": 1,
      "The Dungog Chronicle": 1,
      "The Evelyn Observer, and South and East Bourke Record": 1,
      "The Evening Advocate": 1,
      "The Evening Journal": 2,
      "The Evening News": 3,
      "The Examiner": 1,
      "The Express and Telegraph": 1,
      "The Fitzroy City Press": 1,
      "The Freeman's Journal": 7,
      "The Geelong Advertiser": 3,
      "The Geelong Advertiser and Intelligencer": 1,